{
  "schema_version": 1,
  "report_path": "podcast-learning/reports/2026-10-18_ximalaya-ailianjinshu_xiaohui-renxin-ai-startup.md",
  "quality_tier": "important",
  "created_on": "2026-10-19",
  "generator": {
    "model": "gpt-6.1-sol",
    "harness": "codex",
    "run_id": "generator-xiaohui-renxin-20261019",
    "explicit_model_override": false,
    "override_reason": ""
  },
  "task": {
    "summary": "仅使用 Razer 静默转写，完成晓辉与任鑫关于 AI 创业、评估和企业转型的长篇播客学习报告。",
    "requirements": [
      {
        "id": "R01",
        "text": "核验未重复处理，并对超出 pull 上限的 Razer transcript 做可追溯分片与哈希校验。"
      },
      {
        "id": "R02",
        "text": "覆盖先卖再做、测试集即工作、服务产品化、早点关公司和企业 AI 转型。"
      },
      {
        "id": "R03",
        "text": "把节目观点与播客任务机制实践连接，区分口播估计、事实和推断。"
      }
    ]
  },
  "sources": [
    {
      "id": "S01",
      "kind": "local",
      "title": "晓辉 × 任鑫原始转写（Razer worker）",
      "locator": "podcast-learning/reports/transcripts/2026-10-18_ximalaya-ailianjinshu_xiaohui-renxin-ai-startup.transcript.txt",
      "accessed_on": "2026-10-19"
    },
    {
      "id": "S02",
      "kind": "local",
      "title": "晓辉 × 任鑫结构化精编稿",
      "locator": "podcast-learning/reports/transcripts/2026-10-18_ximalaya-ailianjinshu_xiaohui-renxin-ai-startup.polished.txt",
      "accessed_on": "2026-10-19"
    },
    {
      "id": "S03",
      "kind": "local",
      "title": "喜马拉雅单集页 shownotes",
      "locator": "podcast-learning/reports/transcripts/2026-10-18_ximalaya-ailianjinshu_xiaohui-renxin-ai-startup.shownotes.md",
      "accessed_on": "2026-10-19"
    },
    {
      "id": "S04",
      "kind": "primary",
      "title": "AI炼金术单集页",
      "locator": "https://www.ximalaya.com/sound/1025210406",
      "accessed_on": "2026-10-19"
    },
    {
      "id": "S05",
      "kind": "local",
      "title": "晓辉 × 任鑫 Razer artifact、分片与传输回执",
      "locator": "podcast-learning/reports/transcripts/2026-10-18_ximalaya-ailianjinshu_xiaohui-renxin-ai-startup.artifact.json",
      "accessed_on": "2026-10-19"
    },
    {
      "id": "S06",
      "kind": "local",
      "title": "Treg Agent 生态对篇报告",
      "locator": "podcast-learning/reports/2026-10-18_xiaoyuzhou-crossing_treg-agent-ecosystem.md",
      "accessed_on": "2026-10-19"
    },
    {
      "id": "S07",
      "kind": "local",
      "title": "Articuler.ai 创业与 GTM 对篇报告",
      "locator": "podcast-learning/reports/2026-10-17_xiaoyuzhou-42zhangjing_articuler-jason.md",
      "accessed_on": "2026-10-19"
    },
    {
      "id": "S08",
      "kind": "local",
      "title": "EverAgent 报告 ACE 工作流",
      "locator": "docs/REPORT_WORKFLOW.md",
      "accessed_on": "2026-10-19"
    }
  ],
  "claims": [
    {
      "id": "C01",
      "claim": "任鑫认为 AI 使做东西的市场价值可能贬值约 100 倍，因此建议先卖、收钱或订单，再做。",
      "report_anchor": "AI 把“做出来”变便宜后",
      "support": "direct",
      "source_ids": [
        "S01",
        "S02",
        "S03"
      ],
      "evidence": "转写 00:16:08–00:17:42 与 shownotes 核心观点 1。",
      "critical": true
    },
    {
      "id": "C02",
      "claim": "企业采用 AI 前应先定义业务价值与验收测试集；定义标准本身就是人的工作。",
      "report_anchor": "测试集就是工作的说法",
      "support": "direct",
      "source_ids": [
        "S01",
        "S02",
        "S03"
      ],
      "evidence": "转写 00:27:36–00:30:50 记录两个问题、验收标准和测试集。",
      "critical": true
    },
    {
      "id": "C03",
      "claim": "服务只有同时满足有人买单、毛利高、可复制，才值得产品化。",
      "report_anchor": "服务转产品需要三重证据",
      "support": "direct",
      "source_ids": [
        "S01",
        "S02",
        "S03"
      ],
      "evidence": "转写 00:24:58–00:25:27 明确列出三个门槛。",
      "critical": true
    },
    {
      "id": "C04",
      "claim": "第二次创业的核心复盘是已证伪假设应尽早关公司，必要时缩到少数人继续探索。",
      "report_anchor": "早点关公司",
      "support": "direct",
      "source_ids": [
        "S01",
        "S02",
        "S03"
      ],
      "evidence": "转写 00:48:04–00:50:48 通过袋鼠改签比喻说明关闭组织与继续探索的区别。",
      "critical": true
    },
    {
      "id": "C05",
      "claim": "个人播客卡片流程使用要/不要反馈、每日反思和每周汇总来更新偏好，并要求现实外部校准。",
      "report_anchor": "可与 ACE 比较的生活化流程",
      "support": "direct",
      "source_ids": [
        "S01",
        "S02"
      ],
      "evidence": "转写 00:31:00–00:32:35 与 02:06:54–02:07:18。",
      "critical": true
    }
  ],
  "limitations": [
    "100 倍、10–100 倍与价格下降等为口播估计或修辞。",
    "企业转型服务仍在早期，未披露留存、退款、毛利和复制结果。",
    "精编仅保留约 5.5% 汉字量，许多个人经历和问答细节被压缩。"
  ]
}
