{
  "schema_version": 1,
  "report_path": "podcast-learning/reports/2026-10-18_xiaoyuzhou-crossing_treg-agent-ecosystem.md",
  "quality_tier": "important",
  "created_on": "2026-10-19",
  "generator": {
    "model": "gpt-6.1-sol",
    "harness": "codex",
    "run_id": "generator-2026-10-18_xiaoyuzhou-crossing_treg-agent-ecosystem-20261019",
    "explicit_model_override": false,
    "override_reason": ""
  },
  "task": {
    "summary": "仅使用 Razer 静默转写，完成 Treg 单期播客的转写、精编、学习报告，并从实践提炼播客任务机制改进。",
    "requirements": [
      {
        "id": "R01",
        "text": "核验该期未重复处理，转写必须来自 Razer，保存 transcript、shownotes 与 polished。"
      },
      {
        "id": "R02",
        "text": "报告区分嘉宾口播、预测和分析，保留关键数字、Limitations 与思考追问。"
      },
      {
        "id": "R03",
        "text": "分析 Claude Code/Codex 生态、工具数据市场与多 Agent 人类瓶颈，并关联既有知识。"
      }
    ]
  },
  "sources": [
    {
      "id": "S01",
      "kind": "local",
      "title": "Treg 原始转写（Razer worker）",
      "locator": "podcast-learning/reports/transcripts/2026-10-18_xiaoyuzhou-crossing_treg-agent-ecosystem.transcript.txt",
      "accessed_on": "2026-10-19"
    },
    {
      "id": "S02",
      "kind": "local",
      "title": "Treg 结构化精编稿",
      "locator": "podcast-learning/reports/transcripts/2026-10-18_xiaoyuzhou-crossing_treg-agent-ecosystem.polished.txt",
      "accessed_on": "2026-10-19"
    },
    {
      "id": "S03",
      "kind": "local",
      "title": "Treg 单集页面 shownotes",
      "locator": "podcast-learning/reports/transcripts/2026-10-18_xiaoyuzhou-crossing_treg-agent-ecosystem.shownotes.md",
      "accessed_on": "2026-10-19"
    },
    {
      "id": "S04",
      "kind": "primary",
      "title": "十字路口 Treg 单集页",
      "locator": "https://www.xiaoyuzhoufm.com/episode/6ad2412d0e4e410a05be01a7",
      "accessed_on": "2026-10-19"
    },
    {
      "id": "S05",
      "kind": "local",
      "title": "Treg Razer artifact 与传输回执",
      "locator": "podcast-learning/reports/transcripts/2026-10-18_xiaoyuzhou-crossing_treg-agent-ecosystem.artifact.json",
      "accessed_on": "2026-10-19"
    },
    {
      "id": "S06",
      "kind": "local",
      "title": "EverAgent 报告 ACE 工作流",
      "locator": "docs/REPORT_WORKFLOW.md",
      "accessed_on": "2026-10-19"
    }
  ],
  "claims": [
    {
      "id": "C01",
      "claim": "团队约 9 个月经历设计 Agent、增长 Agent、数据与工具市场三次 Pivot，并判断未来 6–12 个月零人公司不成立。",
      "report_anchor": "Treg 团队 9 个多月三次 Pivot",
      "support": "direct",
      "source_ids": [
        "S01",
        "S02",
        "S03"
      ],
      "evidence": "转写 00:02–00:14 与 shownotes Part 1 记录三次方向变化及零人公司判断。",
      "critical": true
    },
    {
      "id": "C02",
      "claim": "早期 Codex 插件改变 SuperDesign 增长曲线；Treg 上线约三周，收入已达 SuperDesign 数倍。",
      "report_anchor": "真正改变增长曲线的是早期 Codex 插件",
      "support": "direct",
      "source_ids": [
        "S01",
        "S02",
        "S03"
      ],
      "evidence": "转写 00:14:42–00:18:03 明确记录插件分发与相对收入口径。",
      "critical": true
    },
    {
      "id": "C03",
      "claim": "Treg 计划用 Agent 对 endpoint 的有用性、字段质量与性价比反馈形成路由数据飞轮。",
      "report_anchor": "Agent 是用户",
      "support": "direct",
      "source_ids": [
        "S01",
        "S02"
      ],
      "evidence": "转写 00:23:39–00:25:42 描述 Agent 评分、客观与主观指标及后续路由。",
      "critical": true
    },
    {
      "id": "C04",
      "claim": "团队同时运行 5–10 个 Session 后，人类成为状态管理和验收瓶颈，并用短小 Loop 与主 Agent 分发任务。",
      "report_anchor": "同时跑 5–10 个 Session",
      "support": "direct",
      "source_ids": [
        "S01",
        "S02",
        "S03"
      ],
      "evidence": "转写 00:36:18–00:40:19 记录短 Loop 原则、并发数量与大副 Agent 思路。",
      "critical": true
    }
  ],
  "limitations": [
    "收入、Star、Token 价值和工具用量为嘉宾自述，未做第三方核验。",
    "中英专名误识别较多，历史增长 Agent 产品名无法唯一确认。",
    "Treg 上线时间短，留存、供应商议价和评分抗作弊缺长期数据。"
  ]
}
